Question,Answer
"What is SAP BRIM?","SAP BRIM is a comprehensive solution for managing billing and revenue for high-volume businesses. It helps in streamlining processes from product configuration, order capture, and fulfillment to invoicing, billing, and revenue recognition."
"Can you explain the components of SAP BRIM?","The main components include SAP Convergent Charging (CC), SAP Convergent Invoicing (CI), SAP Customer Financial Management (CFM), SAP Revenue Accounting and Reporting (RAR), and Subscription Order Management (SOM)."
"What is the role of SAP Convergent Charging in BRIM?","It is responsible for calculating charges for services and usage in real-time, allowing businesses to create flexible pricing models and bundles."
"How does SAP Convergent Invoicing contribute to BRIM?","SAP CI consolidates billing data from various sources into a single invoice, handling both prepaid and postpaid billing models."
"What is the purpose of SAP Customer Financial Management?","CFM manages customer financial transactions, including payments, collections, and disputes, ensuring efficient accounts receivable processes."
"How does SAP Revenue Accounting and Reporting work within BRIM?","RAR helps in recognizing revenue accurately and in compliance with accounting standards like IFRS 15, managing the revenue recognition process."
"What is Subscription Order Management in SAP BRIM?","SOM manages subscription-based orders, from order creation through fulfillment, supporting complex order management scenarios."
"Can you explain the end-to-end process flow in SAP BRIM?","The flow starts with product configuration, followed by order management, service and consumption charging, invoicing, and finally, financial customer management."
"How do you handle real-time charging and rating in SAP BRIM?","Real-time charging and rating are handled through SAP Convergent Charging, which processes usage data against pricing models to calculate charges instantly."
"What are the challenges in implementing SAP BRIM?","Challenges include integrating multiple components, managing high volumes of data, ensuring billing accuracy, and complying with financial standards."
"How can SAP BRIM handle complex billing scenarios?","By utilizing flexible pricing and bundling options in Convergent Charging and leveraging Convergent Invoicing for composite billing requirements."
"What is the significance of SAP Hybris in BRIM?","SAP Hybris (now part of SAP Customer Experience) enhances BRIM by providing front-end customer engagement and commerce solutions."
"How does SAP BRIM support digital transformation?","It enables businesses to adapt to digital business models, supporting flexible, usage-based pricing and automated billing processes."
"Can SAP BRIM be integrated with other SAP solutions?","Yes, it seamlessly integrates with SAP S/4HANA, SAP CRM, and other SAP solutions for comprehensive business process management."
"What is the best practice for data migration in SAP BRIM?","Utilize SAP Data Services for efficient data migration, ensuring data quality and consistency throughout the process."
"How do you ensure billing accuracy in SAP BRIM?","By implementing thorough testing of pricing models in Convergent Charging and validating billing data through Convergent Invoicing."
"What role does analytics play in SAP BRIM?","Analytics provide insights into billing and revenue data, helping businesses make informed decisions and improve financial performance."
"How can SAP BRIM be customized for specific industry needs?","Through its modular architecture and flexible configuration options, allowing businesses to tailor the solution to their unique requirements."
"What is the future scope of SAP BRIM?","The scope includes further integration with cloud services, enhancements in AI for predictive analytics, and more robust digital payment solutions."
"Can you explain how dispute management is handled in SAP BRIM?","Dispute management is facilitated by the Customer Financial Management component of SAP BRIM. It provides tools for tracking, managing, and resolving billing disputes, ensuring timely resolution and maintaining customer satisfaction."
"What are the key components of the SAP BRIM solution, and how do they integrate with each other?","SAP BRIM consists of several key components: SAP Convergent Charging (SAP CC) for rate management and pricing, SAP Convergent Invoicing (SAP CI) for invoicing and billing, SAP Contract Accounts Receivable and Payable (SAP FI-CA) for financial accounting, SAP Customer Financial Management (SAP FICA) for credit and collections management. These components integrate seamlessly to handle complex billing and revenue management processes."
"How does SAP BRIM handle complex billing scenarios, such as subscription-based services?","SAP BRIM is designed to handle complex billing scenarios through its flexible pricing and billing engines. Subscription-based services are managed using SAP Convergent Charging (SAP CC) to define and apply complex pricing models, including usage-based pricing, tiered pricing, and recurring charges. SAP Convergent Invoicing (SAP CI) then consolidates these charges into a single invoice, ensuring accurate billing for all services provided."
"Explain the process of setting up a charge plan in SAP Convergent Charging?","Setting up a charge plan involves: Define chargeable items (CIs) which represent the billable events, Create a charge plan by specifying the pricing logic including rate steps and discounts, Associate the charge plan with relevant chargeable items, Configure the charge plan to handle different billing cycles and customer categories, Test the charge plan, Deploy the charge plan for use in production."
"What are the best practices for implementing SAP BRIM in a multi-national corporation?","Best practices include: Conducting thorough requirements analysis, Ensuring compliance with local regulations and tax laws, Implementing scalable and flexible architecture, Utilizing multi-currency and multi-language capabilities, Engaging in comprehensive testing and training, Establishing robust change management process."
"How can SAP BRIM improve revenue recognition processes?","SAP BRIM improves revenue recognition processes by automating and standardizing the entire billing and revenue management lifecycle. It ensures revenue is recognized accurately and in compliance with accounting standards such as IFRS 15, provides real-time visibility into revenue streams, and integrates with financial systems to reduce manual errors and improve efficiency."
"Describe the role of SAP FI-CA in the SAP BRIM solution?","SAP FI-CA manages all financial transactions related to customer contracts, handling billing, invoicing, collections, and payment processing. It ensures accurate tracking of receivables and payables, provides detailed financial reporting, and supports dunning processes for overdue accounts."
"What are the common challenges faced during SAP BRIM implementation, and how can they be mitigated?","Common challenges include: Complex integration with existing systems (mitigated by thorough planning), Customization needs (addressed by leveraging flexible configuration options), Data migration issues (managed by detailed data mapping and validation), User adoption (ensured through training programs), Regulatory compliance (maintained by staying updated with local regulations)."
"How does SAP BRIM support real-time billing and invoicing?","SAP BRIM supports real-time billing and invoicing through integration with SAP Convergent Charging (SAP CC) and SAP Convergent Invoicing (SAP CI). SAP CC processes real-time usage data and applies appropriate pricing models, while SAP CI consolidates charges and generates invoices on demand."
"What is the significance of SAP Convergent Charging in managing complex pricing models?","SAP Convergent Charging allows for the definition and application of intricate pricing rules and structures. It supports various pricing schemes such as usage-based pricing, tiered pricing, discounts, and promotional offers, enabling businesses to create customized pricing models that meet specific needs."
"How can businesses leverage SAP BRIM to enhance customer experience?","Businesses can leverage SAP BRIM by providing accurate, transparent, and timely billing with detailed invoices. The system's flexibility allows for personalized pricing and billing options, such as bundled services and subscription plans, while real-time billing and proactive account management help address issues promptly."
"What are the key components of SAP BRIM, and how do they integrate to support end-to-end billing and revenue management processes?","The key components are Subscription Order Management (SOM), SAP Convergent Charging (SAP CC), SAP Convergent Invoicing (SAP CI), and SAP Revenue Accounting and Reporting (RAR). These components integrate seamlessly to manage the entire billing and revenue lifecycle, from subscription orders to revenue recognition."
"How does SAP Convergent Charging (SAP CC) handle real-time rating and charging of services?","SAP CC handles real-time rating and charging using a highly scalable architecture that can process large volumes of transactions in real-time. It uses pricing logic to determine service costs based on usage data and predefined pricing rules, allowing for flexible pricing models."
"Explain the concept of charging plans in SAP BRIM.","Charging plans define the pricing logic and conditions for charging services. They outline rules for calculating charges based on usage data, including conditions such as time of usage, volume of usage, and customer-specific pricing agreements."
"What role does SAP Convergent Invoicing (SAP CI) play in the billing process?","SAP CI consolidates charges from various sources, including SAP Convergent Charging, and generates invoices. It manages billing processes such as invoicing, accounts receivable, and collections, ensuring accurate and timely billing with transparency."
"How does SAP BRIM support revenue recognition compliance with standards like IFRS 15?","SAP BRIM supports compliance through its SAP Revenue Accounting and Reporting (RAR) module, which automates revenue recognition by capturing data from billing systems and applying recognition rules that comply with IFRS 15."
"Describe the process of integrating SAP BRIM with external systems for data exchange.","Integration involves using APIs, web services, and middleware to facilitate data exchange with CRM systems, ERP systems, and third-party applications, ensuring seamless data flow between systems for accurate billing, invoicing, and reporting."
"What are the benefits of using the accelerator in SAP BRIM implementations?","The accelerator provides a fast, reliable, and scalable platform with pre-configured templates, best practices, and automation tools. It reduces implementation time and costs while ensuring a robust and flexible solution."
"How does SAP BRIM handle complex billing scenarios such as bundled services and multi-tiered pricing?","SAP BRIM handles complex billing through flexible configuration options and a powerful pricing engine, allowing for bundled services with combined pricing and discounts, and multi-tiered pricing based on usage thresholds or customer segments."
"Explain the importance of real-time analytics in SAP BRIM?","Real-time analytics are crucial for providing immediate insights into customer behavior, usage patterns, and revenue trends. They help companies make informed decisions, optimize pricing strategies, improve customer satisfaction, and enable proactive management of billing issues."
"What are the challenges in implementing SAP BRIM, and how can they be addressed?","Challenges include data migration from legacy systems, integration with existing IT infrastructure, and customization for specific business requirements. These can be addressed through thorough planning, experienced consultants, comprehensive testing, stakeholder involvement, and adequate user training."
"STOs are stored on Custom table, This table needs to monitor periodically to clear all the STO's.","To archive the STO'S all the items need to be marketed for deletion. We have archived the STO's once the deletion is set and archived as requested by the user."
"We could see that MSSA table in Prod  system crossed 860million entries","We have performed completed archiving for the data existing in scope and brought down the size of the table"
"please check why there is no invoice  in the VBRK archive table","Indexing is performed for the archived data so the data now exists in /N/PBS/VF03 table"
"Please archive Credit Memo and Credit Memo Request ","Requested the user to mark the credit for deletion and then proceeded with archiving"
"Archive entry is existing in both DB and /PBS/FB03","Post processing is being performed to delete the secondary indexes existing in the table "
"When executing Custom tcode in QA system by selecting Database + Archive option, it is giving below error. Please check
Error Message : ""*****/PBS/CFIF  xxxxxx  could not be read. ARCHIVE_READ_OBJECT OPEN_ERROR
Message No :  /PBS/CFI600","Post refresh activites are performed in the system to resolve the issue"
"Please help us extract data from the archive.

Tried to run tcode /n/pbs/se16, it falls in error every time","The archived data cannot be downloaded in bulk at a single phase as its account related details hence requested to use /n/pbs/fb03 to get the complete details "
"kindly help us in generating.

message Type = Custom Message ","IDOCs Purging is in progress. Once the data is purged the data cannot viewed neither in DB nor using archiving t-codes"
"WORKITEM write job failure in Production System due to ASSIGN CONFLICT ERROR","Implemented SAP Note 2355625 - Work item archiving dumps with ASSIGN_TYPE_CONFLICT
"
"Request for retrieval of billing documents","Please be informed that once data is archived, we cannot retrieve it and use the T-code /PBS/VF03 in order to view the documents"
"Please perform archiving process for the Incorrect combination of Valuation Types and Storage Location at listed in attachment materials in Poland","Executed a report for all the materials with incorrect combination  valuation types & Storage location "
"Is there any possibility way to archive the material document number ","The document cannot be archived as the document hasn't reached the residency period. "
"Duplicates occuring billing docs","Found the duplicate session and invalidated one of the session to resolve the issue"
"Material | Plant | Storage for DF and archiving-PIR deletion","Archived the materials with respective plants & storage location"
"During the execution of transaction /n/pbs/fbl5n the transaction does not unload open positions for some client IDs correctly.","To overcome the issue archiving should not be in progress during the execution of this tcode for checking account balances. So performing the archiving on provided timelines"
"Archiving less volume for functional data","Due to technical closure not done for open documents; Technical closure needs to be done "
"FI_FICA object - Write job cancelled due to "" TSV_TNEW_PAGE_ALLOC_FAILED ""error","We implemented SAP note 3278614 - Archiving: Global variable is refreshed even before the Archiving to resolve the issue"
"ISU_BCONT Write job takes huge time","We Implemneted SAP Note 3133244 to resolve the issue"
"Expiration date is not updating as per the policy configured","We Referred SAP Note 3317399  for resolve the issue"
"FI_DOCUMNT object File conversion job taking long Time","We referred Snote-3086530 - FI_DOCUMENT_ARCH_ADMI_UPDATE: Changes to optimize the performance to resolve the issue"
"File Conversion Issue for FI_MKKCOLL Object ","the ""Available time reference"" is having an invalid value ""End_of_Fiscal_year"".
We followed the below steps:
1. Remove available time reference ""End_of_Fiscal_year"" from:
    IRM_CUST -> ILM objects -> FI_MKKCOLL -> Available Time Reference.
    After remove it, you would only have ""last_change_date"" in the list.
2. Double check ILM policy from IRMPOL
    Make sure no policy using ""End_of_Fiscal_year"" as time reference condition.  "
"Old Archive Files Still Exist in Open Text Content Server after File Conversion","1) Enable the checkbox ""Automatic destruction of replaced files""                                                                                                                                                                                                       2) Post this enablement, we could have ILM_DESTRUCTION executed for the replaced files which are left over in the source content repository."
"ISU_EABL Object not picking all the records in write Program","We implemented the pilot note given by SAP -  3419846 after implementing the pilot note issue got resolved"
"Audit area issue while running simulation for ISU_BILLZ. ISU_BILLZ was reading more than one audit area(Tax )","Removed inheritence check box in IRM_CUST"
" Choose the key from the allowed namespace in IRM_CUST","Implemented SAP Notes 2121883 - FI_MKKCOLL : ILM enablement and 2121886 - FI_MKKSUMM : ILM enablement."
"598: Input or output error (triggered during access to file system, WebDAV, or data stream; see long text)
CX_XADK_DAS_SERVER
DA S","Issue resolved after checking log/RCS logs at OpenText side "
"Store job DESTINATION_NOT_FOUND error","Implemented OSS
2569041
2061366"
"Following an error, an operation was carried out on a handle
Job cancelled after system exception ERROR_MESSAGE","SAP suggested to implement OSS notes
2948694 & 2750197 / SAP suggested to configur policy with  offset(Month/year)"
" Archiving file is not deleting from temporary - File conversion","2104707 - ILM file conversion: Archiving job does not delete physical file in exchange directory"
"Archived data is not accessible for some of the transaciton codes","Assign the transaciton codes with Archvie enabled authorization for the needed users"
"Data not found for certain years","Populate data to archive infostructures for the missing years"
"What is SAP and how does it benefit my business?","SAP is an enterprise resource planning (ERP) software that helps businesses manage various operations including finance supply chain and human resources. By centralizing data and processes SAP enables companies to make informed decisions reduce inefficiencies and optimize operations across different departments."
"What are the key modules available in SAP?","SAP offers a wide range of modules including Financial Accounting (FI) Sales and Distribution (SD) Materials Management (MM) Human Capital Management (HCM) and more. Each module focuses on a specific business process providing comprehensive functionalities to handle different operational needs."
"What are the benefits of migrating to SAP S/4HANA?","Migrating to SAP S/4HANA provides real-time data processing simplified architecture and enhanced performance. It enables businesses to operate more efficiently make better decisions with real-time insights and leverage innovative technologies like AI and machine learning for advanced analytics."
"What are the benefits of moving SAP to the cloud?","Moving SAP to the cloud offers scalability cost-efficiency and flexibility. Cloud deployment reduces the need for on-premise infrastructure and allows businesses to quickly scale resources as needed improving system availability and security while lowering total costs."
"What cloud platforms are compatible with SAP?","SAP is compatible with major cloud platforms such as Microsoft Azure Amazon Web Services (AWS) and Google Cloud Platform (GCP). These platforms offer high-performance infrastructure and services to run SAP applications seamlessly."
"How do I migrate my SAP systems to the cloud?","SAP cloud migration involves assessing current systems selecting the right cloud platform and developing a migration strategy (lift and shift re-platforming etc.). The process requires planning testing and execution to ensure minimal downtime and data integrity during the move."
"What is RISE with SAP?","RISE with SAP is an offering that makes moving to the cloud as easy as possible for customers and provides individual support throughout the transformation to the intelligent enterprise. It is a subscription package based on a service level agreement (SLA) where SAP bundles various components into a single package at a uniform price."
"What are the advantages of RISE with SAP?","RISE with SAP has several benefits divided into three areas: business benefits for companies continuous and accompanied transformation and reduction of complexity. It enables faster transformation with SAP S/4HANA Cloud SAP Business Technology Platform and Signavio's solution portfolio. It provides ongoing support and simplifies contracts with one agreement covering software support infrastructure and technical services."
"What is included in RISE with SAP?","RISE with SAP includes three core elements: 1. Cloud solutions (including SAP S/4HANA Cloud) 2. Cloud Infrastructure and Services (managed by SAP with service level agreements) 3. Migration and implementation services (tools and methods for business analysis and process optimization)."
"How do RISE with SAP and SAP S/4HANA Cloud differ?","RISE with SAP supports companies in their transformation to the intelligent enterprise and cloud journey. While SAP S/4HANA Cloud is a core element of RISE with SAP the RISE offering goes beyond it including solutions for process optimization automation and various technical tools and services."
"What is GROW with SAP?","GROW with SAP is a commercial bundle created specifically for medium-sized businesses to benefit from cloud ERP advantages in a short time. It offers speed flexibility predictable costs continuous technical innovations and scalability. It gives SMEs access to SAP's extensive know-how and preconfigured best practices."
"Who is the GROW with SAP offer aimed at?","GROW with SAP is aimed primarily at growing midmarket companies that don't yet use an ERP system from SAP or are planning to introduce ERP for a subsidiary. It's particularly suitable for companies whose processes are not overly complex and specific as only public cloud ERP is offered."
"What does the GROW with SAP bundle include?","The bundle consists of three modules: 1. Technological solutions (cloud ERP and other tools including SAP S/4HANA Cloud Public Edition and SAP Business Technology Platform) 2. Services for rapid cloud ERP implementation (adoption services) 3. Knowledge and training resources."
"What are the disadvantages of GROW with SAP?","The main disadvantage is that SAP GROW only provides the public cloud version of S/4HANA which is highly standardized and therefore not suitable for companies with niche operations very specific processes or extraordinary legal regulations. Additionally it's unclear whether and how a subsequent switch from GROW to a private or sovereign cloud can be realized."
"What is SAP BRIM?","SAP BRIM is a comprehensive solution for managing billing and revenue for high-volume businesses. It helps in streamlining processes from product configuration order capture and fulfillment to invoicing billing and revenue recognition."
"What are the components of SAP BRIM?","The main components include SAP Convergent Charging (CC) SAP Convergent Invoicing (CI) SAP Customer Financial Management (CFM) SAP Revenue Accounting and Reporting (RAR) and Subscription Order Management (SOM)."
"What is the role of SAP Convergent Charging in BRIM?","It is responsible for calculating charges for services and usage in real-time allowing businesses to create flexible pricing models and bundles."
"How does SAP Convergent Invoicing contribute to BRIM?","SAP CI consolidates billing data from various sources into a single invoice handling both prepaid and postpaid billing models."
"How does SAP Revenue Accounting and Reporting work within BRIM?","RAR helps in recognizing revenue accurately and in compliance with accounting standards like IFRS 15 managing the revenue recognition process."
"What is Subscription Order Management in SAP BRIM?","SOM manages subscription-based orders from order creation through fulfillment supporting complex order management scenarios."
"How do you handle real-time charging and rating in SAP BRIM?","Real-time charging and rating are handled through SAP Convergent Charging which processes usage data against pricing models to calculate charges instantly."
"What are the challenges in implementing SAP BRIM?","Challenges include integrating multiple components managing high volumes of data ensuring billing accuracy and complying with financial standards."
"How can SAP BRIM handle complex billing scenarios?","By utilizing flexible pricing and bundling options in Convergent Charging and leveraging Convergent Invoicing for composite billing requirements."
"What are the cloud solutions supporting SAP HANA Scale up?","SAP HANA Scale up can be deployed in Azure AWS GCP clouds."
"What is the physical memory limitation of scale up?","Scale up can only be possible till 32 TB of RAM (Azure) & 24 TB (AWS GCP)."
"What are the main hardware limitations when scaling up SAP HANA?","The primary hardware limitations include the maximum capacity of CPU and RAM that a single server can support. Once these limits are reached further scaling up is not possible."
"What is the physical memory limitation of scale out?","Scale out can only be possible until 4 nodes with 24 TB per node (96 TB max)."
"How many standby nodes can be added to scale out?","We can add 1 or more standby nodes depending on the HA solution preferred by customer."
"When should you choose Scale-Out over Scale-Up?","When your data requirements exceed the capacity of a single server."
