Question,Answer
"What are the benefits of Scaling Out?","Increased Capacity which will handle larger data volumes & Improved Performance with distributing workloads across the worker nodes."
"How do you manage data distribution in a Scale-Out environment?","Data distribution is managed by partitioning tables and distributing them across different servers. SAP HANA automatically handles data placement and movement to optimize performance."
"What are the key considerations for high availability in Scale-Out setup?","Host Auto-Failover ensures standby nodes can take over in case of failure. System Replication provides data redundancy and quick recovery. Regular Backups ensures data integrity and availability."
"What tools are available for monitoring Scale-Out systems?","Tools like SAP HANA Cockpit and SAP HANA Studio provide comprehensive monitoring and management capabilities helping track performance manage resources and ensure system health."
"What are the limitations of Scaling Out?","Complexity in managing multiple servers higher costs due to additional hardware and maintenance and potential increased network latency between servers."
"What are the required network configurations for scale out?","SAP HANA Scale out needs 4 network configurations: 1. Internode communication within HANA nodes 2. External communication for application connectivity 3. HSR communication for system replication 4. Storage communication between storage sites."
"How can the system restart time be minimized?","By using HANA Fast Restart Option (FRO) system restart time can be reduced by 70-80%."
"What HANA version is recommended for HLI?","SAP HANA 2.00.077+"
"How is security handled in SAP systems?","SAP ensures data security through robust encryption access control mechanisms and regular updates. SAP GRC solutions help businesses meet regulatory standards and manage risks by monitoring user activity and automating compliance processes."
"What is IAM and why is it important?","IAM (Identity and Access Management) helps businesses control who can access SAP systems and what they can do ensuring only authorized users have access to specific data and functionalities."
"How can I optimize my existing SAP systems?","Optimizing SAP systems involves reviewing current workflows eliminating redundancies and automating manual tasks. Tools like Signavio help analyze processes identify inefficiencies and streamline operations."
"What are the best practices for implementing SAP?","Best practices include thorough requirements analysis ensuring compliance with regulations implementing scalable architecture comprehensive testing and training and establishing robust change management processes."
"How does SAP support digital transformation?","SAP enables digital transformation through cloud solutions AI/ML capabilities process automation analytics and integration capabilities supporting flexible business models and automated processes."
"What are the key considerations for capacity planning?","Consider current and future workload requirements use tools like SAP's Quick Sizer for resource estimation and plan for growth to avoid frequent scaling."
"How is performance monitoring handled?","Performance monitoring uses tools like SAP HANA Cockpit to track system metrics identify scaling needs and ensure optimal operation."
"What integration capabilities does SAP offer?","SAP provides extensive integration capabilities through APIs web services and middleware supporting connection with CRM ERP and third-party applications."
"How are system updates and maintenance handled?","Updates and maintenance are managed through systematic processes including testing environments change management procedures and scheduled maintenance windows to minimize disruption."
"What disaster recovery options are available?","Disaster recovery options include system replication backup and restore procedures high availability configurations and cloud-based disaster recovery solutions."
"How is data migration handled in SAP?","Data migration involves detailed planning data mapping cleansing validation and testing ensuring data integrity and consistency throughout the process."
"What support levels are available?","Support includes self-service (Level-1) AI-assisted support (Level-2) and expert support (Level-3) with varying levels of engagement and response times."
"How are custom developments managed?","Custom developments are managed through development environments like SAP Business Application Studio following best practices for clean core principles and modular architecture."
"What reporting capabilities are available?","SAP provides comprehensive reporting through tools like SAP Analytics Cloud supporting real-time analytics customizable dashboards and advanced visualization options."
"How is system performance optimized?","System performance optimization involves monitoring resources tuning databases managing workloads and implementing best practices for system configuration."
"What are the key security considerations?","Security considerations include access control encryption compliance monitoring user authentication and authorization and regular security updates."
"How is user training handled?","User training is supported through SAP Learning Hub documentation resources hands-on workshops and customized training programs."
"What automation capabilities are available?","Automation capabilities include process automation workflow automation testing automation and administrative task automation through various SAP tools."
"How are system landscapes managed?","System landscapes are managed through tools like SAP Solution Manager covering development testing and production environments with proper change management."
"What are the best practices for testing?","Testing best practices include comprehensive test planning automated testing regression testing performance testing and user acceptance testing."
"How is compliance maintained?","Compliance is maintained through regular audits monitoring tools automated compliance checks and proper documentation of processes and changes."
"What mobile capabilities does SAP offer?","SAP provides mobile access through various apps and platforms enabling secure access to SAP systems from mobile devices."
"How is data quality ensured?","Data quality is maintained through validation rules data governance processes regular audits and data cleansing procedures."
"What analytics tools are available?","Analytics tools include SAP Analytics Cloud SAP BusinessObjects and embedded analytics providing comprehensive business intelligence capabilities."
"How are business processes modeled?","Business processes are modeled using tools like SAP Signavio following industry best practices and allowing for process optimization."
"What deployment options are available?","Deployment options include on-premise cloud hybrid and private cloud deployments with various implementation approaches."
"How is system access controlled?","System access is controlled through role-based access control user authentication authorization levels and security policies."
"What are the key factors for successful implementation?","Success factors include proper planning stakeholder engagement clear objectives adequate resources proper testing and effective change management."